{
  "$schema": "./manifest.schema.json",
  "schemaVersion": "0.1.0",
  "fixture": {
    "id": "catalog-capability-evidence-mv-mz-merge",
    "title": "Catalog MV/MZ Capability Evidence Merge Fixture",
    "kind": "synthetic",
    "summary": "Synthetic public fixture demonstrating MV/MZ public adapter matrix evidence merged with private-local aggregate sidecar evidence as separate readiness inputs.",
    "sourceLocale": "ja-JP",
    "targetLocales": [],
    "publicRedistribution": "allowed",
    "license": {
      "spdx": "CC0-1.0",
      "evidence": "Hand-authored synthetic JSON with aggregate counts only; contains no private-local corpus paths, filenames, keys, screenshots, or raw text."
    },
    "provenance": {
      "author": "Itotori fixture authors",
      "creationMethod": "Hand-authored public synthetic merge fixture for CATALOG-007 mapper tests.",
      "rawAssetPolicy": "contains-no-copyrighted-game-assets"
    }
  },
  "files": [
    {
      "path": "fixtures/public/catalog-capability-evidence-mv-mz-merge/input/merge-fixture-v0.1.json",
      "role": "metadata",
      "mediaType": "application/json",
      "sha256": "c1c0e2a92f8e2654c58de165ab0cef60b646b6360cf80ccf8cc473af4b22cdec",
      "bytes": 1927,
      "redistributable": true
    },
    {
      "path": "fixtures/public/catalog-capability-evidence-mv-mz-merge/input/merge-public-only-v0.1.json",
      "role": "metadata",
      "mediaType": "application/json",
      "sha256": "43f486294163862a0d40f58acc983b04d6b99eba9ec35c0ce1a101099a9cec6d",
      "bytes": 1093,
      "redistributable": true
    },
    {
      "path": "fixtures/public/catalog-capability-evidence-mv-mz-merge/expected/readiness-merge-v0.1.json",
      "role": "expected-output",
      "mediaType": "application/json",
      "sha256": "cd0880a312c4f25db115dcd45a229688016c6143ead6994255f6455eb9baa421",
      "bytes": 2313,
      "redistributable": true
    },
    {
      "path": "fixtures/public/catalog-capability-evidence-mv-mz-merge/expected/readiness-public-only-v0.1.json",
      "role": "expected-output",
      "mediaType": "application/json",
      "sha256": "51e62f1ca74ea8e967492d8316bfa4010d85d4876f7d99b0167de1781af67d8f",
      "bytes": 1252,
      "redistributable": true
    }
  ],
  "aggregateStats": {
    "files": 4,
    "textUnits": 0,
    "sourceTextUtf16CodeUnits": 0,
    "protectedSpans": 0,
    "sourceLocales": ["ja-JP"],
    "targetLocales": [],
    "engineKinds": ["rpg-maker-mv-mz-synthetic-capability-evidence"],
    "notes": "Synthetic aggregate evidence only; public fixture support and private-local aggregate evidence remain separate."
  },
  "benchmarkUse": {
    "allowedInPublicCi": true,
    "allowedInPublicReports": true,
    "reportingLabel": "public:catalog-capability-evidence-mv-mz-merge"
  }
}
