{
  "$schema": "./manifest.schema.json",
  "schemaVersion": "0.1.0",
  "fixture": {
    "id": "hello-game",
    "title": "Hello Fixture",
    "kind": "synthetic",
    "summary": "Synthetic public game fixture v0.2 covering multiple localization text surfaces for the hello-world localization loop.",
    "sourceLocale": "ja-JP",
    "targetLocales": ["en-US", "fr-FR"],
    "publicRedistribution": "allowed",
    "license": {
      "spdx": "CC0-1.0",
      "evidence": "Synthetic fixture text and metadata authored for repository tests; no third-party raw assets."
    },
    "provenance": {
      "author": "Itotori contributors",
      "creationMethod": "Hand-authored synthetic multi-surface fixture for CI, contract snapshots, and documentation.",
      "rawAssetPolicy": "contains-no-copyrighted-game-assets"
    }
  },
  "files": [
    {
      "path": "fixtures/hello-game/source.json",
      "role": "source-game",
      "mediaType": "application/json",
      "sha256": "7b156e100fbebd6f53cc71a89cd134cc0281a4ddc493486ca291e83a3bd55a5d",
      "bytes": 10756,
      "redistributable": true
    },
    {
      "path": "fixtures/hello-game/expected/bridge-v0.1.json",
      "role": "bridge-bundle",
      "mediaType": "application/json",
      "sha256": "97043e2f54ad6805af89dcfdbeaffe4033e2c82302ba8a7195e57f920ac4cd8f",
      "bytes": 6528,
      "redistributable": true
    },
    {
      "path": "fixtures/hello-game/expected/bridge-v0.2.json",
      "role": "bridge-bundle",
      "mediaType": "application/json",
      "sha256": "724e1fa64fb7ff3f5d8b43381435d80b892c0fe3373ee70f1565a5469d595689",
      "bytes": 31575,
      "redistributable": true
    },
    {
      "path": "fixtures/hello-game/expected/patch-export-v0.2.fr-FR.json",
      "role": "patch-export",
      "mediaType": "application/json",
      "sha256": "4e398ccde1cd3e7f0e4af0ac258cc3b9fec60da5765afb2b7fc0009f3dbd8328",
      "bytes": 9076,
      "redistributable": true
    },
    {
      "path": "fixtures/hello-game/expected/patch-result-v0.2.fr-FR.json",
      "role": "patch-result",
      "mediaType": "application/json",
      "sha256": "a6c44fa4d44937a5f963d25c9579042a46f37d2d15df897b99cf49ae50444c55",
      "bytes": 6551,
      "redistributable": true
    },
    {
      "path": "fixtures/hello-game/expected/round-trip-golden-report-v0.1.json",
      "role": "expected-output",
      "mediaType": "application/json",
      "sha256": "cb3d51c721f06a068816c514f68da08dce844b9d21313afeb91aa6cc9eb4e2d7",
      "bytes": 2333,
      "redistributable": true
    },
    {
      "path": "fixtures/hello-game/expected/delta-package-v0.2.fr-FR.json",
      "role": "delta-package",
      "mediaType": "application/json",
      "sha256": "1229878319572b0aee28fd8121c62ec87ffd4b415813c1009debc81cc77666cd",
      "bytes": 1970,
      "redistributable": true
    },
    {
      "path": "fixtures/hello-game/expected/runtime-report-v0.2.fr-FR.json",
      "role": "runtime-report",
      "mediaType": "application/json",
      "sha256": "c71310b80e2e96bb6420c608da080e248a6433cfd1a2f6e65abe508ff485ec0b",
      "bytes": 6879,
      "redistributable": true
    },
    {
      "path": "fixtures/hello-game/expected/benchmark-report-v0.2.fr-FR.json",
      "role": "benchmark-report",
      "mediaType": "application/json",
      "sha256": "e08217064d9fc1eb95fd6d848c29628cff24c0520d4a4f03eace72cf2d4075b3",
      "bytes": 6731,
      "redistributable": true
    },
    {
      "path": "fixtures/hello-game/expected/finding-v0.2.fr-FR.json",
      "role": "finding",
      "mediaType": "application/json",
      "sha256": "757fb7dd628e0bc23790c751842c30cae411d4342667e23e93aff7826cd43c5c",
      "bytes": 2194,
      "redistributable": true
    },
    {
      "path": "fixtures/hello-game/surface-coverage-v0.2.json",
      "role": "metadata",
      "mediaType": "application/json",
      "sha256": "a064359b4d3aabb8776ae78dd4dc49c4a7bf2f42e10a54bfb582d2f60cc0754b",
      "bytes": 4378,
      "redistributable": true
    },
    {
      "path": "fixtures/hello-game/asset-inventory.expected.json",
      "role": "expected-output",
      "mediaType": "application/json",
      "sha256": "d2eb600b6b95cc4e5faf4df9b8d65142f774e94cac0f4a24c1d8f0b6febe6bf9",
      "bytes": 11213,
      "redistributable": true
    }
  ],
  "aggregateStats": {
    "files": 12,
    "textUnits": 11,
    "sourceTextUtf16CodeUnits": 84,
    "protectedSpans": 3,
    "sourceLocales": ["ja-JP"],
    "targetLocales": ["en-US", "fr-FR"],
    "engineKinds": ["synthetic-json"],
    "notes": "Fixture v0.2 covers dialogue, speaker names, choices, UI labels, tutorial text, database/glossary-like terms, image text, metadata text, placeholders, inline control markup, explicit logical asset metadata for six non-text asset surfaces, and full-system expected artifacts for fr-FR patching, runtime trace evidence, benchmark reporting, and seeded finding regression coverage."
  },
  "benchmarkUse": {
    "allowedInPublicCi": true,
    "allowedInPublicReports": true,
    "reportingLabel": "public:hello-game"
  }
}
